<!ELEMENT requests (request)+>
        <!ELEMENT request (clientId , requestId , name , quantity , price)>
        <!ELEMENT clientId (#PCDATA)*>
        <!ELEMENT requestId (#PCDATA)>
        <!ELEMENT name (#PCDATA)>
        <!ELEMENT quantity (#PCDATA)>
        <!ELEMENT price (#PCDATA)>